user_id,title,authors,status,image_url
3e60c37d-ba9e-47c5-8b12-857a651e8a42,"Titanium Noir (Titanium Noir, #1)",Nick Harkaway,up_next,
3e60c37d-ba9e-47c5-8b12-857a651e8a42,Kill Your Friends,John Niven,up_next,
3e60c37d-ba9e-47c5-8b12-857a651e8a42,A Particularly Nasty Case,Adam Kay,finished,
3e60c37d-ba9e-47c5-8b12-857a651e8a42,Mind & Body: Mental exercises for physical wellbeing; physical exercises for mental wellbeing,"The School of Life, Alain de Botton",in_progress,
3e60c37d-ba9e-47c5-8b12-857a651e8a42,Of Mice and Men,John Steinbeck,finished,
3e60c37d-ba9e-47c5-8b12-857a651e8a42,East of Eden,John Steinbeck,in_progress,
3e60c37d-ba9e-47c5-8b12-857a651e8a42,Fear and Loathing in Las Vegas: A Savage Journey to the Heart of the American Dream,"Hunter S. Thompson, Ralph Steadman",finished,
3e60c37d-ba9e-47c5-8b12-857a651e8a42,Just Kids,Patti Smith,up_next,
3e60c37d-ba9e-47c5-8b12-857a651e8a42,The White Album,Joan Didion,up_next,
3e60c37d-ba9e-47c5-8b12-857a651e8a42,Slouching Towards Bethlehem,Joan Didion,up_next,
3e60c37d-ba9e-47c5-8b12-857a651e8a42,"Slow Days, Fast Company: The World, the Flesh, and L.A.",Eve Babitz,up_next,
3e60c37d-ba9e-47c5-8b12-857a651e8a42,"Walden or, Life in the Woods","Henry David Thoreau, Bill McKibben",up_next,
3e60c37d-ba9e-47c5-8b12-857a651e8a42,Genghis Khan and the Making of the Modern World,Jack Weatherford,up_next,
3e60c37d-ba9e-47c5-8b12-857a651e8a42,Frankenstein: The 1818 Text,"Mary Wollstonecraft Shelley, Charlotte  Gordon",finished,
3e60c37d-ba9e-47c5-8b12-857a651e8a42,Never Split the Difference: Negotiating as if Your Life Depended on It,"Chris Voss, Tahl Raz",finished,
3e60c37d-ba9e-47c5-8b12-857a651e8a42,"The Next Conversation: Argue Less, Talk More",Jefferson Fisher,finished,
3e60c37d-ba9e-47c5-8b12-857a651e8a42,"Rabbit, Run (Rabbit Angstrom, #1)",John Updike,up_next,
3e60c37d-ba9e-47c5-8b12-857a651e8a42,Too Far to Go: The Maples Stories,John Updike,up_next,
3e60c37d-ba9e-47c5-8b12-857a651e8a42,Fathers and Sons,"Ivan Turgenev, George Reavy, Jane Costlow",up_next,
3e60c37d-ba9e-47c5-8b12-857a651e8a42,The Slight Edge,Jeff Olson,up_next,
3e60c37d-ba9e-47c5-8b12-857a651e8a42,We Would Have Told Each Other Everything,Judith Hermann,finished,
3e60c37d-ba9e-47c5-8b12-857a651e8a42,Minor Detail,"Adania Shibli, Elisabeth Jaquette",up_next,
3e60c37d-ba9e-47c5-8b12-857a651e8a42,Flesh,David Szalay,finished,
3e60c37d-ba9e-47c5-8b12-857a651e8a42,The Alchemist,Paulo Coelho,finished,
3e60c37d-ba9e-47c5-8b12-857a651e8a42,Forty Autumns: A Family's Story of Courage and Survival on Both Sides of the Berlin Wall,Nina Willner,finished,
3e60c37d-ba9e-47c5-8b12-857a651e8a42,The Five People You Meet in Heaven,Mitch Albom,finished,
3e60c37d-ba9e-47c5-8b12-857a651e8a42,"Dune (Dune, #1)",Frank Herbert,finished,
3e60c37d-ba9e-47c5-8b12-857a651e8a42,Who Wants to Live Forever,Hanna Thomas Uose,finished,
3e60c37d-ba9e-47c5-8b12-857a651e8a42,The First 90 Days: Proven Strategies for Getting Up to Speed Faster and Smarter,Michael D. Watkins,up_next,
3e60c37d-ba9e-47c5-8b12-857a651e8a42,The Coddling of the American Mind: How Good Intentions and Bad Ideas Are Setting up a Generation for Failure,"Jonathan Haidt, Greg Lukianoff",up_next,
3e60c37d-ba9e-47c5-8b12-857a651e8a42,"The Bullet That Missed (Thursday Murder Club, #3)",Richard Osman,finished,
3e60c37d-ba9e-47c5-8b12-857a651e8a42,Go Tell It on the Mountain,James Baldwin,finished,
3e60c37d-ba9e-47c5-8b12-857a651e8a42,What You Are Looking for Is in the Library,"Michiko Aoyama, Alison Watts",finished,
3e60c37d-ba9e-47c5-8b12-857a651e8a42,Alchemy: The Surprising Power of Ideas That Don't Make Sense,Rory Sutherland,up_next,
3e60c37d-ba9e-47c5-8b12-857a651e8a42,"Peter Pan (Peter Pan, #2)","J.M. Barrie, Michael Hague",finished,
3e60c37d-ba9e-47c5-8b12-857a651e8a42,All Fours,Miranda July,up_next,
3e60c37d-ba9e-47c5-8b12-857a651e8a42,Project Hail Mary,Andy Weir,finished,
3e60c37d-ba9e-47c5-8b12-857a651e8a42,The Creative Act: A Way of Being,Rick Rubin,up_next,
3e60c37d-ba9e-47c5-8b12-857a651e8a42,"When the Lion Feeds (Courtney, #1)",Wilbur Smith,up_next,
3e60c37d-ba9e-47c5-8b12-857a651e8a42,The Last Resort: A Memoir of Zimbabwe,Douglas Rogers,up_next,
3e60c37d-ba9e-47c5-8b12-857a651e8a42,The Africa House: The True Story of an English Gentleman and His African Dream,Christina Lamb,up_next,
3e60c37d-ba9e-47c5-8b12-857a651e8a42,Meditations for Mortals: Four Weeks to Embrace Your Limitations and Make Time for What Counts,Oliver Burkeman,up_next,
3e60c37d-ba9e-47c5-8b12-857a651e8a42,Doughnut Economics: Seven Ways to Think Like a 21st-Century Economist,Kate Raworth,up_next,
3e60c37d-ba9e-47c5-8b12-857a651e8a42,The Paris Secret,Natasha Lester,finished,
3e60c37d-ba9e-47c5-8b12-857a651e8a42,The Fourth Turning: An American Prophecy—What the Cycles of History Tell Us About America's Next Rendezvous with Destiny,"William Strauss, Neil Howe",up_next,
3e60c37d-ba9e-47c5-8b12-857a651e8a42,The Madefor Method: A step-by-step guide designed by world-renowned experts to help you get better at being your best,Patrick Dossett,up_next,
3e60c37d-ba9e-47c5-8b12-857a651e8a42,Breath: The New Science of a Lost Art,James Nestor,up_next,
3e60c37d-ba9e-47c5-8b12-857a651e8a42,Orbital,Samantha Harvey,finished,
3e60c37d-ba9e-47c5-8b12-857a651e8a42,The Kite Runner,Khaled Hosseini,finished,
3e60c37d-ba9e-47c5-8b12-857a651e8a42,Lolita,Vladimir Nabokov,finished,
3e60c37d-ba9e-47c5-8b12-857a651e8a42,Perfume: The Story of a Murderer,"Patrick Süskind, John E. Woods",up_next,
3e60c37d-ba9e-47c5-8b12-857a651e8a42,To Kill a Mockingbird,Harper Lee,finished,
3e60c37d-ba9e-47c5-8b12-857a651e8a42,Kitchen Confidential: Adventures in the Culinary Underbelly,Anthony Bourdain,up_next,
3e60c37d-ba9e-47c5-8b12-857a651e8a42,Make Something Wonderful,Steve Jobs,finished,
3e60c37d-ba9e-47c5-8b12-857a651e8a42,Verity,Colleen Hoover,finished,
3e60c37d-ba9e-47c5-8b12-857a651e8a42,Hamnet,Maggie O'Farrell,finished,
3e60c37d-ba9e-47c5-8b12-857a651e8a42,On the Suffering of the World,Arthur Schopenhauer,up_next,
3e60c37d-ba9e-47c5-8b12-857a651e8a42,A Christmas Carol,"Charles Dickens, Joe L. Wheeler",finished,
3e60c37d-ba9e-47c5-8b12-857a651e8a42,How Proust Can Change Your Life,Alain de Botton,finished,
3e60c37d-ba9e-47c5-8b12-857a651e8a42,"Maybe You Should Talk to Someone: A Therapist, Her Therapist, and Our Lives Revealed",Lori Gottlieb,up_next,
3e60c37d-ba9e-47c5-8b12-857a651e8a42,"The Midnight Library (The Midnight World, #1)",Matt Haig,finished,
3e60c37d-ba9e-47c5-8b12-857a651e8a42,Liar's Poker,Michael   Lewis,up_next,
3e60c37d-ba9e-47c5-8b12-857a651e8a42,Sea of Tranquility,Emily St. John Mandel,up_next,
3e60c37d-ba9e-47c5-8b12-857a651e8a42,"Tomorrow, and Tomorrow, and Tomorrow",Gabrielle Zevin,finished,
3e60c37d-ba9e-47c5-8b12-857a651e8a42,Good to Great: Why Some Companies Make the Leap... and Others Don't,Jim Collins,finished,
3e60c37d-ba9e-47c5-8b12-857a651e8a42,Hooked: How to Build Habit-Forming Products,"Nir   Eyal, Ryan Hoover",finished,
3e60c37d-ba9e-47c5-8b12-857a651e8a42,Sapiens: A Brief History of Humankind,Yuval Noah Harari,finished,
3e60c37d-ba9e-47c5-8b12-857a651e8a42,On the Origin of Time: Stephen Hawking's Final Theory,Thomas Hertog,in_progress,
3e60c37d-ba9e-47c5-8b12-857a651e8a42,Educated,Tara Westover,finished,
3e60c37d-ba9e-47c5-8b12-857a651e8a42,Thinking In Systems: A Primer,"Donella H. Meadows, Diana Wright",up_next,
3e60c37d-ba9e-47c5-8b12-857a651e8a42,Confessions of a Yakuza: A Life in Japan's Underworld,"Junichi Saga, John Bester",finished,
3e60c37d-ba9e-47c5-8b12-857a651e8a42,The Odyssey,"Homer, Robert Fagles, Bernard Knox",up_next,
3e60c37d-ba9e-47c5-8b12-857a651e8a42,The Ministry for the Future,Kim Stanley Robinson,finished,
3e60c37d-ba9e-47c5-8b12-857a651e8a42,"You're Invited: The Art and Science of Connection, Trust, and Belonging",Jon  Levy,up_next,
3e60c37d-ba9e-47c5-8b12-857a651e8a42,Invention: A Life,James Dyson,finished,
3e60c37d-ba9e-47c5-8b12-857a651e8a42,"Zen and the Art of Motorcycle Maintenance: An Inquiry Into Values (Phaedrus, #1)",Robert M. Pirsig,up_next,
3e60c37d-ba9e-47c5-8b12-857a651e8a42,Playing to the Gallery,Grayson Perry,finished,
3e60c37d-ba9e-47c5-8b12-857a651e8a42,Stoner,"John  Williams, John McGahern",finished,
3e60c37d-ba9e-47c5-8b12-857a651e8a42,The 48 Laws of Power,Robert Greene,up_next,
3e60c37d-ba9e-47c5-8b12-857a651e8a42,13 Things That Don't Make Sense: The Most Baffling Scientific Mysteries of Our Time,Michael Brooks,up_next,
3e60c37d-ba9e-47c5-8b12-857a651e8a42,"The Wager: A Tale of Shipwreck, Mutiny and Murder",David Grann,up_next,
3e60c37d-ba9e-47c5-8b12-857a651e8a42,Untamed,"Glennon Doyle, Glennon Doyle Melton",finished,
3e60c37d-ba9e-47c5-8b12-857a651e8a42,The Hero With a Thousand Faces,Joseph Campbell,up_next,
3e60c37d-ba9e-47c5-8b12-857a651e8a42,Principles: Life and Work,"Ray Dalio, Jeremy Bobb",in_progress,
3e60c37d-ba9e-47c5-8b12-857a651e8a42,The Beekeeper of Aleppo,Christy Lefteri,finished,
3e60c37d-ba9e-47c5-8b12-857a651e8a42,Why I'm No Longer Talking to White People About Race,Reni Eddo-Lodge,finished,
3e60c37d-ba9e-47c5-8b12-857a651e8a42,"How to be a Graphic Designer, Without Losing Your Soul",Adrian Shaughnessy,finished,
3e60c37d-ba9e-47c5-8b12-857a651e8a42,On the Road,Jack Kerouac,finished,
3e60c37d-ba9e-47c5-8b12-857a651e8a42,Dangerous Dimensions: Mind-bending Tales of the Mathematical Weird (British Library Tales of the Weird),Henry Bartholomew,up_next,
3e60c37d-ba9e-47c5-8b12-857a651e8a42,"The Power of Limits: Proportional Harmonies in Nature, Art, and Architecture",György Doczi,up_next,
3e60c37d-ba9e-47c5-8b12-857a651e8a42,When We Cease to Understand the World,"Benjamín Labatut, Adrian Nathan West",finished,
3e60c37d-ba9e-47c5-8b12-857a651e8a42,Men Without Women,"Haruki Murakami, Phillip Gabriel, Ted Goossen, Chip Kidd",finished,
3e60c37d-ba9e-47c5-8b12-857a651e8a42,The Wind-Up Bird Chronicle,"Haruki Murakami, Jay Rubin",finished,
3e60c37d-ba9e-47c5-8b12-857a651e8a42,On Earth We're Briefly Gorgeous,Ocean Vuong,up_next,
3e60c37d-ba9e-47c5-8b12-857a651e8a42,Becoming Trader Joe: How I Did Business My Way and Still Beat the Big Guys,"Joe Coulombe, Patty Civalleri",up_next,
3e60c37d-ba9e-47c5-8b12-857a651e8a42,21 Lessons for the 21st Century,Yuval Noah Harari,up_next,
3e60c37d-ba9e-47c5-8b12-857a651e8a42,"The Four: The Hidden DNA of Amazon, Apple, Facebook, and Google",Scott Galloway,up_next,
3e60c37d-ba9e-47c5-8b12-857a651e8a42,Dare to Lead,Brené Brown,up_next,
3e60c37d-ba9e-47c5-8b12-857a651e8a42,The Victorian Internet: The Remarkable Story of the Telegraph and the Nineteenth Century's On-line Pioneers,Tom Standage,up_next,
3e60c37d-ba9e-47c5-8b12-857a651e8a42,"The Thursday Murder Club (Thursday Murder Club, #1)",Richard Osman,finished,
3e60c37d-ba9e-47c5-8b12-857a651e8a42,"The Man Who Died Twice (Thursday Murder Club, #2)",Richard Osman,finished,
3e60c37d-ba9e-47c5-8b12-857a651e8a42,"The Satsuma Complex (Gary Thorn, #1)",Bob Mortimer,finished,
3e60c37d-ba9e-47c5-8b12-857a651e8a42,"Ritz and Escoffier: The Hotelier, The Chef, and the Rise of the Leisure Class",Luke Barr,finished,
3e60c37d-ba9e-47c5-8b12-857a651e8a42,Designing Design,Kenya Hara,up_next,
3e60c37d-ba9e-47c5-8b12-857a651e8a42,Four Thousand Weeks,Oliver Burkeman,finished,
3e60c37d-ba9e-47c5-8b12-857a651e8a42,The Beginning of Infinity: Explanations That Transform the World,David Deutsch,in_progress,
3e60c37d-ba9e-47c5-8b12-857a651e8a42,Atomic Habits: An Easy & Proven Way to Build Good Habits & Break Bad Ones,James Clear,finished,
3e60c37d-ba9e-47c5-8b12-857a651e8a42,Courage: The Joy of Living Dangerously,Osho,up_next,
3e60c37d-ba9e-47c5-8b12-857a651e8a42,Last Night a DJ Saved My Life: The History of the Disc Jockey,"Bill Brewster, Frank Broughton",up_next,
3e60c37d-ba9e-47c5-8b12-857a651e8a42,Creative Selection: Inside Apple's Design Process During the Golden Age of Steve Jobs,Ken Kocienda,finished,
3e60c37d-ba9e-47c5-8b12-857a651e8a42,Shoe Dog: A Memoir by the Creator of Nike,Phil Knight,finished,
3e60c37d-ba9e-47c5-8b12-857a651e8a42,"Ready Player One (Ready Player One, #1)",Ernest Cline,finished,
3e60c37d-ba9e-47c5-8b12-857a651e8a42,The Nickel Boys,Colson Whitehead,up_next,
3e60c37d-ba9e-47c5-8b12-857a651e8a42,We Begin at the End,Chris  Whitaker,finished,
3e60c37d-ba9e-47c5-8b12-857a651e8a42,Brave New World,Aldous Huxley,finished,
3e60c37d-ba9e-47c5-8b12-857a651e8a42,Uncanny Valley,Anna Wiener,up_next,
3e60c37d-ba9e-47c5-8b12-857a651e8a42,Deep Work: Rules for Focused Success in a Distracted World,Cal Newport,up_next,
3e60c37d-ba9e-47c5-8b12-857a651e8a42,1984,George Orwell,finished,
3e60c37d-ba9e-47c5-8b12-857a651e8a42,The Invisible Bridge,"Julie Orringer, Arthur Morey",up_next,
3e60c37d-ba9e-47c5-8b12-857a651e8a42,"The Giver (The Giver, #1)",Lois Lowry,up_next,
3e60c37d-ba9e-47c5-8b12-857a651e8a42,The Smartest Guys in the Room: The Amazing Rise and Scandalous Fall of Enron,"Bethany McLean, Peter Elkind",up_next,
3e60c37d-ba9e-47c5-8b12-857a651e8a42,The Catcher in the Rye,J.D. Salinger,finished,
3e60c37d-ba9e-47c5-8b12-857a651e8a42,"The Girl with All the Gifts (The Girl With All the Gifts, #1)",M.R. Carey,up_next,
3e60c37d-ba9e-47c5-8b12-857a651e8a42,The Golden Notebook,Doris Lessing,up_next,
3e60c37d-ba9e-47c5-8b12-857a651e8a42,Ubik,Philip K. Dick,up_next,
3e60c37d-ba9e-47c5-8b12-857a651e8a42,The Elements of Typographic Style,Robert Bringhurst,finished,
3e60c37d-ba9e-47c5-8b12-857a651e8a42,The Design of Everyday Things,Donald A. Norman,finished,
3e60c37d-ba9e-47c5-8b12-857a651e8a42,Spark for the Fire: How youthful thinking unlocks creativity,Ian Wharton,finished,
3e60c37d-ba9e-47c5-8b12-857a651e8a42,Read This If You Want to Take Great Photographs,Henry Carroll,finished,
3e60c37d-ba9e-47c5-8b12-857a651e8a42,Design as Art,Bruno Munari,finished,
3e60c37d-ba9e-47c5-8b12-857a651e8a42,How to Think Like a Great Graphic Designer,"Debbie Millman, Steven Heller",finished,
3e60c37d-ba9e-47c5-8b12-857a651e8a42,"Thinking, Fast and Slow",Daniel Kahneman,in_progress,
3e60c37d-ba9e-47c5-8b12-857a651e8a42,Lean UX: Applying Lean Principles to Improve User Experience,"Jeff Gothelf, Josh Seiden",finished,
3e60c37d-ba9e-47c5-8b12-857a651e8a42,The Lean Startup,Eric Ries,finished,
3e60c37d-ba9e-47c5-8b12-857a651e8a42,"Creativity, Inc.: Overcoming the Unseen Forces That Stand in the Way of True Inspiration","Ed Catmull, Amy    Wallace",finished,
